[
  {
    "schema_version": "2.0",
    "event_id": "EVT-20260708-1302-0001",
    "actionable": true,
    "priority": "HIGH",
    "fault_summary": "1302CB-1302-KT漏电跳闸（36 mA）",
    "notices": [
      {
        "audience": "RESIDENT",
        "house_ids": [
          "1302"
        ],
        "title": "厨房插座回路因漏电跳闸",
        "content": "07-08 19:05，您家厨房插座回路因为漏电自动断电，重新合上后又跳闸，共3次。可能是插座进水或电器受潮。请先不要再合闸，拔掉这条回路上的电器插头并保持干燥，物业电工会尽快上门检查。",
        "self_check_steps": [
          "拔掉该回路插座上的所有电器插头",
          "查看插座附近是否有水渍或溅水",
          "确认干燥前不要再次合闸"
        ],
        "show_repair_button": false
      },
      {
        "audience": "PROPERTY",
        "house_ids": [
          "1302"
        ],
        "title": "1302漏电跳闸",
        "content": "厨房插座回路在07-08 19:05因漏电跳闸，跳闸时漏电流36 mA（保护动作值30 mA），3小时内重新合闸后又跳闸，共3次。请安排电工尽快上门，排查前不要恢复供电。",
        "self_check_steps": [],
        "show_repair_button": false
      }
    ],
    "workorders": [
      {
        "create_mode": "IMMEDIATE",
        "recheck_after_days": null,
        "fault_type": "电气故障",
        "suggested_trade": "电工维修",
        "house_ids": [
          "1302"
        ],
        "location": "CB-1302-KT",
        "device_code": "EL-1302-K-01",
        "ai_summary": "1302CB-1302-KT漏电跳闸：入住初期约2.34 mA，跳闸时36.2 mA（动作值30 mA），已扣除湿度与负载影响。可疑部位：厨房操作台上方厨房插座-1(0.33)，厨房冰箱位厨房插座-2(0.22)，厨房插座回路线缆(0.10)。建议逐个断开插座/电器做绝缘电阻测试。",
        "materials": [
          "绝缘电阻测试仪",
          "防水插座面板",
          "插座",
          "绝缘胶带"
        ],
        "worker_safety_notice": [
          "作业前断开该回路断路器并用验电笔验电",
          "断电后挂牌警示，防止他人误合闸"
        ]
      }
    ],
    "control_suggestions": [],
    "escalation": null,
    "knowledge_refs": []
  }
]