[
  {
    "schema_version": "2.0",
    "event_id": "EVT-20260625-BLDG-0001",
    "actionable": true,
    "priority": "HIGH",
    "fault_summary": "楼栋L2相过电压，供电侧问题",
    "notices": [
      {
        "audience": "PROPERTY",
        "house_ids": [
          "102"
        ],
        "title": "楼栋L2相过电压",
        "content": "2天内共838分钟电压超出198.0–235.4 V（过电压，最低218 V、最高248 V）；同为L2相的邻户100%同时越限，其它相正常；超出电器允许范围：冰箱（187–242 V）820分钟、电热水器（198–242 V）26分钟。属于供电侧问题，请联系供电部门检查变压器挡位和线路，并通知受影响住户。",
        "self_check_steps": [],
        "show_repair_button": false
      },
      {
        "audience": "NEIGHBOR",
        "house_ids": [
          "102",
          "105",
          "202",
          "205",
          "302",
          "305",
          "402",
          "405",
          "502",
          "505",
          "602",
          "605",
          "702",
          "705",
          "802",
          "805",
          "902",
          "905",
          "1002",
          "1005",
          "1102",
          "1105",
          "1202",
          "1205",
          "1302",
          "1305",
          "1402",
          "1405",
          "1502",
          "1505",
          "1602",
          "1605",
          "1702",
          "1705",
          "1802",
          "1805"
        ],
        "title": "近期楼栋供电过电压",
        "content": "近期楼栋部分时段供电电压最高达到248伏，高于正常上限235伏，已超出冰箱、电热水器的允许电压。物业已联系供电部门处理，期间外出时建议拔掉不用的电器插头。",
        "self_check_steps": [
          "外出时拔掉不用的电器插头",
          "发现电器异常发热或有焦味立即断电"
        ],
        "show_repair_button": false
      }
    ],
    "workorders": [
      {
        "create_mode": "IMMEDIATE",
        "recheck_after_days": null,
        "fault_type": "电气故障",
        "suggested_trade": "电工维修",
        "house_ids": [
          "102",
          "105",
          "202",
          "205",
          "302",
          "305",
          "402",
          "405",
          "502",
          "505",
          "602",
          "605",
          "702",
          "705",
          "802",
          "805",
          "902",
          "905",
          "1002",
          "1005",
          "1102",
          "1105",
          "1202",
          "1205",
          "1302",
          "1305",
          "1402",
          "1405",
          "1502",
          "1505",
          "1602",
          "1605",
          "1702",
          "1705",
          "1802",
          "1805"
        ],
        "location": "1栋1单元配电室L2相",
        "device_code": null,
        "ai_summary": "楼栋L2相过电压：2天内838分钟超出198.0–235.4 V，同相邻户100%同时越限、其它相0%，判断为供电侧。请测量配电室各相电压并联系供电部门调整变压器挡位。",
        "materials": [
          "钳形电流表",
          "电能质量记录仪"
        ],
        "worker_safety_notice": [
          "作业前断开该回路断路器并用验电笔验电",
          "断电后挂牌警示，防止他人误合闸",
          "紧固端子前确认上级开关已断开并验电"
        ]
      }
    ],
    "control_suggestions": [],
    "escalation": null,
    "knowledge_refs": []
  }
]