{
  "schema_version": "2.0",
  "event_id": "EVT-20260715-BATCHB-0001",
  "actionable": true,
  "priority": "HIGH",
  "fault_summary": "MiC B批次马桶进水阀暗漏高发，建议同批次25户预防性巡检",
  "notices": [
    {
      "audience": "PROPERTY",
      "house_ids": [],
      "title": "B批次质量预警：马桶暗漏高发",
      "content": "7-12层B批次模块45天内有7户出现暗漏，发生率是其它批次的3.5倍，统计上显著，其中86%出在马桶进水阀，疑似同批部件问题。另有4户厨房回路端子发热，是其它批次的4倍，但样本少，建议巡检时一并排查。已生成25户巡检工单，建议同步反馈生产厂核查批次部件。",
      "self_check_steps": [],
      "show_repair_button": false
    },
    {
      "audience": "NEIGHBOR",
      "house_ids": [
        "701", "703", "704", "705", "706",
        "802", "804", "805", "806",
        "901", "902", "903", "905",
        "1003", "1004", "1005", "1006",
        "1101", "1102", "1104", "1106",
        "1201", "1202", "1203", "1205"
      ],
      "title": "免费预防性检查预约通知",
      "content": "为提前排除隐患，物业将为您家提供一次免费上门检查，主要检查马桶水箱配件和配电箱接线，约30分钟。您家目前没有发现故障，这是一次预防性检查。维修师傅会提前电话与您确认时间。",
      "self_check_steps": [],
      "show_repair_button": false
    }
  ],
  "workorders": [
    {
      "create_mode": "IMMEDIATE",
      "recheck_after_days": null,
      "fault_type": "给排水故障",
      "suggested_trade": "水电维修",
      "house_ids": [
        "701", "703", "704", "705", "706",
        "802", "804", "805", "806",
        "901", "902", "903", "905",
        "1003", "1004", "1005", "1006",
        "1101", "1102", "1104", "1106",
        "1201", "1202", "1203", "1205"
      ],
      "location": "卫生间-马桶进水阀",
      "device_code": null,
      "ai_summary": "B批次45天暗漏7/36户，其它批次4/72户，发生率比3.5(p=0.031)，86%位于马桶进水阀。预防性巡检：关角阀观察水箱水位是否下降，检查进水阀密封与浮球高度，记录部件型号与批号并回写档案。",
      "materials": ["马桶进水阀", "水箱密封圈", "色素检漏片"],
      "worker_safety_notice": [
        "入户前与住户确认时间，佩戴工牌",
        "关闭马桶角阀后再拆卸进水阀"
      ]
    },
    {
      "create_mode": "IMMEDIATE",
      "recheck_after_days": null,
      "fault_type": "电气故障",
      "suggested_trade": "电工维修",
      "house_ids": [
        "701", "703", "704", "705", "706",
        "802", "804", "805", "806",
        "901", "902", "903", "905",
        "1003", "1004", "1005", "1006",
        "1101", "1102", "1104", "1106",
        "1201", "1202", "1203", "1205"
      ],
      "location": "配电箱-厨房回路断路器端子",
      "device_code": null,
      "ai_summary": "B批次45天端子发热4/36户，其它批次2/72户，发生率比4.0但p=0.094尚不显著，4例均位于厨房回路断路器端子。预防性巡检：红外测温各回路端子，复紧端子力矩，记录断路器型号批号并回写档案。",
      "materials": ["红外测温仪", "扭力螺丝刀", "16A断路器"],
      "worker_safety_notice": [
        "复紧端子前验电并断开对应回路，挂牌上锁",
        "带电红外测温时保持安全距离，不触碰裸露导体"
      ]
    }
  ],
  "control_suggestions": [],
  "escalation": null,
  "knowledge_refs": ["主动运维补充-批次质量巡检"]
}
