{
  "schema_version": "2.0",
  "event_id": "EVT-20260806-1302-0011",
  "actionable": true,
  "priority": "URGENT",
  "fault_summary": "1302厨房回路断路器端子接触不良发热（可能性约86%），已自动断电",
  "notices": [
    {
      "audience": "RESIDENT",
      "house_ids": ["1302"],
      "title": "安全提醒：厨房插座已临时断电",
      "content": "系统发现您家配电箱里厨房插座这一路的接线处温度异常升高，存在火灾隐患，已自动切断厨房插座电源。冰箱会暂时停电，请尽量少开冰箱门。请不要自行合闸，也不要用插线板从其它房间给厨房电器接电，电工师傅会尽快上门。",
      "self_check_steps": [
        "不要自行合上厨房插座的开关",
        "不要用插线板从其它房间接电",
        "尽量少开冰箱门"
      ],
      "show_repair_button": false
    },
    {
      "audience": "PROPERTY",
      "house_ids": ["1302"],
      "title": "1302厨房回路端子过热，已分闸",
      "content": "1302厨房插座回路端子温度92℃，电流仅11.8安，同电流温升为正常的3.6倍且持续恶化12天，判断为端子松动或氧化，已自动分闸。已生成紧急电工工单；冰箱断电，请优先安排上门。",
      "self_check_steps": [],
      "show_repair_button": false
    }
  ],
  "workorders": [
    {
      "create_mode": "IMMEDIATE",
      "recheck_after_days": null,
      "fault_type": "电气故障",
      "suggested_trade": "电工维修",
      "house_ids": ["1302"],
      "location": "配电箱-厨房回路断路器出线端子",
      "device_code": null,
      "ai_summary": "1302厨房插座回路(CB-1302-KT)端子温度92℃(环境31℃)，电流11.8A未超额定16A；单位电流平方温升由0.12升至0.43℃/A²，近12天持续恶化，剩余电流正常(3.1mA)，排除过载与漏电。首选断路器出线端子松动/氧化(0.86)，次选进线端子(0.09)。检查端子烧蚀情况，处理后按规定力矩紧固，必要时更换断路器，合闸后复测温升。",
      "materials": ["16A断路器", "扭力螺丝刀", "端子清洁剂", "红外测温仪"],
      "worker_safety_notice": [
        "作业前验电，确认厨房回路及配电箱总开关已断开",
        "断电后挂牌上锁，防止他人误合闸",
        "端子可能仍有余温，戴绝缘手套操作",
        "检查端子周边绝缘层是否碳化，碳化需更换导线"
      ]
    }
  ],
  "control_suggestions": [],
  "escalation": null,
  "knowledge_refs": [
    "电气维修手册-配电箱跳闸",
    "主动运维补充-端子发热处置"
  ]
}
