[
  {
    "schema_version": "2.0",
    "event_id": "EVT-20260625-1302-0001",
    "actionable": true,
    "priority": "NORMAL",
    "fault_summary": "1302CB-1302-BT漏电流持续升高（7 mA）",
    "notices": [
      {
        "audience": "RESIDENT",
        "house_ids": [
          "1302"
        ],
        "title": "卫生间插座回路漏电在增大",
        "content": "系统发现您家卫生间插座回路的漏电最近几天明显变大，目前约7毫安，保护开关在30毫安左右会自动断电。可能是插座受潮或线路老化。为了安全，建议暂时不要在卫生间、厨房使用吹风机等大功率电器。物业已安排电工上门检查。",
        "self_check_steps": [
          "查看插座面板是否发黑、发烫或有水渍"
        ],
        "show_repair_button": false
      }
    ],
    "workorders": [
      {
        "create_mode": "IMMEDIATE",
        "recheck_after_days": null,
        "fault_type": "电气故障",
        "suggested_trade": "电工维修",
        "house_ids": [
          "1302"
        ],
        "location": "CB-1302-BT",
        "device_code": "EL-1302-B-01",
        "ai_summary": "1302CB-1302-BT漏电流渐增：入住初期约0.77 mA，近期6.8 mA（动作值30 mA），已扣除湿度与负载影响。可疑部位：卫生间洗手台旁卫生间插座(0.45)，卫生间插座回路线缆(0.20)。建议逐个断开插座/电器做绝缘电阻测试。",
        "materials": [
          "绝缘电阻测试仪",
          "防水插座面板",
          "插座",
          "绝缘胶带"
        ],
        "worker_safety_notice": [
          "作业前断开该回路断路器并用验电笔验电",
          "断电后挂牌警示，防止他人误合闸"
        ]
      }
    ],
    "control_suggestions": [],
    "escalation": null,
    "knowledge_refs": []
  }
]